{
  "$schema": "https://json-schema.org/draft/2020-12/schema",
  "$id": "https://kiln.dev/agent-protocol/commands/deploy.activate.schema.json",
  "title": "deploy.activate — atomic `current` symlink swap (symlink tmp + rename)",
  "type": "object",
  "additionalProperties": false,
  "required": [
    "site",
    "release_id"
  ],
  "properties": {
    "site": {
      "type": "string",
      "pattern": "^[a-z0-9][a-z0-9-]{0,62}$",
      "description": "Site slug (directory name under /srv/kiln/sites)"
    },
    "release_id": {
      "type": "string",
      "pattern": "^[0-9A-HJKMNP-TV-Z]{26}$",
      "description": "ULID"
    },
    "sites_root": {
      "allOf": [
        {
          "type": "string",
          "pattern": "^/"
        }
      ],
      "default": "/srv/kiln/sites"
    },
    "reload": {
      "type": "array",
      "items": {
        "type": "object",
        "additionalProperties": false,
        "required": [
          "kind"
        ],
        "properties": {
          "kind": {
            "enum": [
              "php_fpm",
              "systemd",
              "proc",
              "frankenphp"
            ]
          },
          "name": {
            "type": "string",
            "description": "php version, unit name, or proc program name"
          }
        }
      }
    },
    "context": {
      "type": "object",
      "additionalProperties": false,
      "required": [],
      "properties": {
        "site_id": {
          "type": "string",
          "pattern": "^[0-9A-HJKMNP-TV-Z]{26}$",
          "description": "ULID"
        },
        "deployment_id": {
          "type": "string",
          "pattern": "^[0-9A-HJKMNP-TV-Z]{26}$",
          "description": "ULID"
        },
        "commit": {
          "type": "string"
        },
        "author": {
          "type": "string"
        },
        "branch": {
          "type": "string"
        },
        "trigger": {
          "enum": [
            "push",
            "manual",
            "api",
            "rollback",
            "schedule"
          ]
        },
        "php_binary": {
          "type": "string",
          "description": "e.g. /usr/bin/php8.4 or 'frankenphp php-cli'"
        }
      },
      "description": "Deployment context. Labels the deployment lifecycle OTLP log events (kiln.event.type=deployment, kiln.deployment.id, kiln.site.id, kiln.release.id, kiln.deployment.phase, kiln.deployment.status); in deploy.hook also exposed to scripts as KILN_SITE_ID, KILN_DEPLOYMENT_ID, KILN_COMMIT, KILN_AUTHOR, KILN_BRANCH, KILN_TRIGGER, KILN_PHP_BINARY"
    }
  },
  "$defs": {
    "result": {
      "type": "object",
      "additionalProperties": false,
      "required": [
        "changed",
        "release_id"
      ],
      "properties": {
        "changed": {
          "type": "boolean",
          "description": "true when the host state was modified"
        },
        "previous_release_id": {
          "type": "string"
        },
        "release_id": {
          "type": "string"
        }
      }
    }
  }
}
