{
  "site": "shop",
  "release_id": "01J9Z8Y7X6W5V4T3S2R1Q0P9N1",
  "reload": [
    {
      "kind": "php_fpm",
      "name": "8.4"
    },
    {
      "kind": "proc",
      "name": "shop-horizon"
    },
    {
      "kind": "frankenphp"
    }
  ],
  "context": {
    "site_id": "01J9Z8Y7X6W5V4T3S2R1Q0P9S1",
    "deployment_id": "01J9Z8Y7X6W5V4T3S2R1Q0P9D1",
    "commit": "3f2c1a9",
    "branch": "main",
    "trigger": "push"
  }
}
